{
  "@context": "https://schema.landscapefoundation.org.au/context/foundation-v1.jsonld",
  "federationSchemaVersion": "1.1.0",
  "standardId": "185",
  "project": {
    "federationSchemaVersion": "1.1.0",
    "projectId": "urn:foundation:node:unsw-la-studio:project:2026-coastal-playground",
    "title": "Coastal playground renewal",
    "nodeId": "urn:foundation:node:unsw-la-studio",
    "nodeType": "university",
    "jurisdiction": {
      "country": "AU",
      "stateOrTerritory": "NSW",
      "lga": "Randwick",
      "locality": "Kensington"
    },
    "projectPhase": "design-development",
    "federationApproved": true,
    "updatedAt": "2026-05-29T00:00:00Z"
  },
  "botanicalAssets": [
    {
      "assetId": "plant-001",
      "taxonID": "2981159",
      "scientificName": "Acacia paradoxa DC.",
      "acceptedScientificName": "Acacia paradoxa DC.",
      "vernacularName": "Hedge wattle",
      "family": "Fabaceae",
      "genus": "Acacia",
      "nativeStatus": "Native",
      "growthForm": "Broadleaf shrub",
      "matureHeight_m": 2.2,
      "matureSpread_m": 2.0,
      "waterRequirementClass": "low",
      "fireResponse": "epicormic",
      "quantity": 24,
      "unit": "each"
    }
  ],
  "siteContext": {
    "soilProfile": {
      "order": "Kurosol",
      "clayPercentBand": "15-25%",
      "phBand": "5.5-6.5",
      "source": "SLGA-derived band"
    },
    "climateBand": {
      "koppenClass": "Cfa",
      "rainfallMmBand": "1000-1200",
      "source": "SILO-derived band"
    },
    "exposure": "coastal",
    "microclimateNotes": "Salt-laden southerly exposure; dune-edge planting zone."
  },
  "climateScreening": {
    "projection": {
      "scenario": "SSP2-4.5",
      "horizon": "2050",
      "baselinePeriod": "1995-2014",
      "rainfallDeltaPct": -4.2,
      "maxTempDeltaC": 1.8,
      "heatwaveDaysDelta": 6,
      "source": "CCIA-aligned regional screening (Run-01 proxy)"
    }
  },
  "siteRisk": {
    "bushfireProneLand": true,
    "balScreeningBand": "bal-12-5",
    "matchedOverlayRefs": ["NSW planning overlay proxy"]
  },
  "sustainability": {
    "climatePositiveClaim": true,
    "nativePlantingPercent": 92,
    "waterSensitiveDesign": true,
    "evidence": [
      {
        "label": "Studio carbon narrative",
        "uri": "https://example.edu.au/studio/2026/coastal-playground/carbon",
        "method": "practice-internal"
      }
    ],
    "disclosureStandard": "AASB S2 aligned narrative (draft)"
  },
  "culturalContext": {
    "sensitivityClass": "open",
    "culturalEngagementLevel": "consulted",
    "connectionToCountrySummary": "Plant palette prioritises local coastal species; engagement with local knowledge holders documented in studio records."
  }
}
